PMID,Title,Authors,Source,PubDate,DOI,Volume,Issue,Pages,URL,Abstract
32423906,Tradeoff between metabolic i-proteasome addiction and immune evasion in triple-negative breast cancer.,"Adwal A, Kalita-de Croft P, Shakya R, Lim M, Kalaw E, Taege LD, McCart Reed AE, Lakhani SR, Callen DF, Saunus JM",Life Sci Alliance. 2020 May 18;3(7):e201900562. doi: 10.26508/lsa.201900562. Print 2020 Jul.,2020 Jul,10.26508/lsa.201900562 e201900562,3,7,,https://pubmed.ncbi.nlm.nih.gov/32423906,"In vitro studies have suggested proteasome inhibitors could be effective in triple-negative breast cancer (TNBC). We found that bortezomib and carfilzomib induce proteotoxic stress and apoptosis via the unfolded protein response (UPR) in TNBC cell lines, with sensitivity correlated with expression of immuno-(PSMB8/9/10) but not constitutive-(PSMB5/6/7) proteasome subunits. Equally, the transcriptomes of i-proteasome-high human TNBCs are enriched with UPR gene sets, and the genomic copy number landscape reflects positive selection pressure favoring i-proteasome activity, but in the setting of adjuvant treatment, this is actually associated with favorable prognosis. Tumor expression of PSMB8 protein (beta5i) is associated with levels of MHC-I, interferon-gamma-inducible proteasome activator PA28beta, and the densities of stromal antigen-presenting cells and lymphocytes (TILs). Crucially, TILs were protective among TNBCs that maintain high beta5i but did not stratify survival amongst beta5i-low TNBCs. Moreover, beta5i expression was lower in brain metastases than in patient-matched primary breast tumors (n = 34; P = 0.007), suggesting that suppression contributes to immune evasion and metastatic progression. Hence, inhibiting proteasome activity could be counterproductive in the adjuvant treatment setting because it potentiates anti-TNBC immunity."
32245495,"Preparation, characterization and in vitro-in vivo evaluation of bortezomib supermolecular aggregation nanovehicles.","Chen MY, Xiao ZK, Lei XP, Li JX, Yu XY, Zhang JY, Ye GD, Guo YJ, Mo G, Li CW, Zhang Y, Zhang LM, Lin ZQ, Fu JJ",J Nanobiotechnology. 2020 Apr 3;18(1):57. doi: 10.1186/s12951-020-00612-7.,2020 Apr 3,10.1186/s12951-020-00612-7 57,18,1,57,https://pubmed.ncbi.nlm.nih.gov/32245495,"BACKGROUNDS: Intolerable toxicity and unsatisfactory therapeutic effects are still big problems retarding the use of chemotherapy against cancer. Nano-drug delivery system promised a lot in increasing the patients' compliance and therapeutic efficacy. As a unique nano-carrier, supermolecular aggregation nanovehicle has attracted increasing interests due to the following advantages: announcing drug loading efficacy, pronouncing in vivo performance and simplified production process. METHODS: In this study, the supermolecular aggregation nanovehicle of bortezomib (BTZ) was prepared to treat breast cancer. RESULTS: Although many supermolecular nanovehicles are inclined to disintegrate due to the weak intermolecular interactions among the components, the BTZ supermolecules are satisfying stable. To shed light on the reasons behind this, the forces driving the formation of the nanovehicles were detailed investigated. In other words, the interactions among BTZ and other two components were studied to characterize the nanovehicles and ensure its stability. CONCLUSIONS: Due to the promising tumor targeting ability of the BTZ nanovehicles, the supermolecule displayed promising tumor curing effects and negligible systemic toxicity."
32242081,Optimization of cell viability assays to improve replicability and reproducibility of cancer drug sensitivity screens.,"Larsson P, Engqvist H, Biermann J, Werner Ronnerman E, Forssell-Aronsson E, Kovacs A, Karlsson P, Helou K, Parris TZ",Sci Rep. 2020 Apr 2;10(1):5798. doi: 10.1038/s41598-020-62848-5.,2020 Apr 2,10.1038/s41598-020-62848-5 5798,10,1,5798,https://pubmed.ncbi.nlm.nih.gov/32242081,"Cancer drug development has been riddled with high attrition rates, in part, due to poor reproducibility of preclinical models for drug discovery. Poor experimental design and lack of scientific transparency may cause experimental biases that in turn affect data quality, robustness and reproducibility. Here, we pinpoint sources of experimental variability in conventional 2D cell-based cancer drug screens to determine the effect of confounders on cell viability for MCF7 and HCC38 breast cancer cell lines treated with platinum agents (cisplatin and carboplatin) and a proteasome inhibitor (bortezomib). Variance component analysis demonstrated that variations in cell viability were primarily associated with the choice of pharmaceutical drug and cell line, and less likely to be due to the type of growth medium or assay incubation time. Furthermore, careful consideration should be given to different methods of storing diluted pharmaceutical drugs and use of DMSO controls due to the potential risk of evaporation and the subsequent effect on dose-response curves. Optimization of experimental parameters not only improved data quality substantially but also resulted in reproducible results for bortezomib- and cisplatin-treated HCC38, MCF7, MCF-10A, and MDA-MB-436 cells. Taken together, these findings indicate that replicability (the same analyst re-performs the same experiment multiple times) and reproducibility (different analysts perform the same experiment using different experimental conditions) for cell-based drug screens can be improved by identifying potential confounders and subsequent optimization of experimental parameters for each cell line."
32162602,Regulation of Fas in response to bortezomib and epirubicin in colorectal cancer cells.,"Cacan E, Ozmen ZC",J Chemother. 2020 Jul;32(4):193-201. doi: 10.1080/1120009X.2020.1740389. Epub 2020 Mar 12.,2020 Jul,10.1080/1120009X.2020.1740389,32,4,193-201,https://pubmed.ncbi.nlm.nih.gov/32162602,"Bortezomib is a reversible proteasome inhibitor affects the ubiquitin-proteasome mechanism to kill cancer cells, and inhibition of the proteasome modulates the expression of multiple target genes at the transcriptional level. Epirubicin is known as an anthracycline agent that interferes with DNA and RNA synthesis, and it can be used with other chemotherapeutic drugs in the treatment of post-surgical breast cancer. Epirubicin may have an anti-tumor effect against broad-spectrum tumor cells. However, it is a non-specific chemotherapeutic agent that can cause high toxicity if not used in appropriate doses. Here, we hypothesize that a combination treatment of bortezomib and epirubicin will induce immunogenic cell death in colorectal cancer cells by increasing expression of death receptors such as Fas, which will make these cancer cells more susceptible to Fas/FasL mediated tumor cell killing. Our data demonstrate that a combination of bortezomib and epirubicin significantly increases the sensitivity of colorectal carcinoma cells, but not healthy non-malignant epithelial cells, to apoptosis. The combination treatment significantly upregulates the transcriptional activation of Fas in colorectal cancer cells but not in normal cells. Our results suggest that combining bortezomib and epirubicin may simultaneously enhance tumor immunogenicity and the induction of antitumor immunity."
32097684,Biotinylated HPMA centered polymeric nanoparticles for Bortezomib delivery.,"Rani S, Sahoo RK, Nakhate KT, Ajazuddin, Gupta U",Int J Pharm. 2020 Apr 15;579:119173. doi: 10.1016/j.ijpharm.2020.119173. Epub 2020 Feb 22.,2020 Apr 15,S0378-5173(20)30157-5 [pii] 10.1016/j.ijpharm.2020.119173,579,,119173,https://pubmed.ncbi.nlm.nih.gov/32097684,"Bortezomib (BTZ) is a proteasome inhibitor as approved by US FDA for the treatment of multiple myeloma. It exhibits significant anti-cancer properties, against solid tumors; but lacks aqueous solubility, chemical stability which hinders its successful formulation development. The present study is an attempt to deliver BTZ using N-(2-hydroxypropyl) methacrylamide (HPMA) based copolymeric conjugates and biotinylated PNPs in an effective manner. Study describes a systematic synthetic pathway to synthesize functional polymeric conjugates such as HPMA-Biotin (HP-BT) HPMA-Polylactic acid (HPLA) and HPMA-PLA-Biotin (HPLA-BT) followed by exhaustive characterization both spectroscopically and microscopically. Our strategy yielded polymeric nanoparticles (PNPs) of narrow size range of 199.7 +/- 1.32 nm. Release studies were performed at pH 7.4 and 5.6. PNPs were 2-folds less hemolytic (p < 0.0001) than pure drug. BTZ loaded PNPs of HPLA-BT demonstrated significant anti-cancer activity against MCF-7 cells. IC(50) value of these PNPs was 56.06 +/- 0.12 nM, which was approximately two folds less than BTZ (p < 0.0001). Cellular uptake study confirmed that higher uptake of formulations might be an outcome of biotin surface tethering characteristics that enhanced selectivity and targeting of formulations efficiently. In vivo pharmacokinetics evidenced increased bioavailability (AUC(0 t-infinity)) of DL-HPLA-BT PNPs (drug loaded) than BTZ with an improved half-life. Overall the developed PNPs led to the improved and effective BTZ delivery."
31939174,Interleukin-8-Induced Invasion Assay in Triple-Negative Breast Cancer Cells.,"Uddin MM, Gaire B, Deza B, Vancurova I",Methods Mol Biol. 2020;2108:107-115. doi: 10.1007/978-1-0716-0247-8_9.,2020,10.1007/978-1-0716-0247-8_9,2108,,107-115,https://pubmed.ncbi.nlm.nih.gov/31939174,"The pro-inflammatory and pro-angiogenic chemokine interleukin-8 (IL-8, CXCL8) induces proliferation and invasion of solid tumor cells. In many types of solid cancer, including triple-negative breast cancer (TNBC), the IL-8 expression is induced by proteasome inhibition. In this chapter, we describe a protocol for the analysis of TNBC cell invasion induced by IL-8 in response to proteasome inhibition by bortezomib (BZ). Using this approach, we show that BZ increases the invasion ability of TNBC cells, and that the BZ-increased TNBC cell invasion is suppressed by IkappaB kinase (IKK) inhibition, which also decreases the IL-8 expression. The experimental protocol includes the cell invasion assay, microscopic evaluation of the invading cells, and quantitative analysis of the obtained images. This protocol should be applicable also for measurement of chemokine-induced tumor cell invasion in other types of cancer cells."
31883459,A light-triggered self-reinforced nanoagent for targeted chemo-photodynamic therapy of breast cancer bone metastases via ER stress and mitochondria mediated apoptotic pathways.,"Huang Y, Xiao Z, Guan Z, Shen Y, Jiang Y, Xu X, Huang Z, Zhao C",J Control Release. 2020 Mar 10;319:119-134. doi: 10.1016/j.jconrel.2019.12.043. Epub 2019 Dec 25.,2020 Mar 10,S0168-3659(19)30762-X [pii] 10.1016/j.jconrel.2019.12.043,319,,119-134,https://pubmed.ncbi.nlm.nih.gov/31883459,"Current therapeutic strategies for the treatment of bone metastases are often limited by the lack of selectivity, severe systemic toxicity and suboptimal efficacy. Nanomedicine meditated chemo-photodynamic therapy provides a promising therapeutic opportunity for enhanced cancer therapy. Herein, we constructed an alendronate (ALN)-functionalized bone-seeking nanoagent (BTZ@ZnPc-ALN) to co-deliver the proteasome inhibitor bortezomib (BTZ) and the photosensitizer Zinc phthalocyanine (ZnPc) for synergistic chemo-photodynamic therapy of bone metastases. Results showed that BTZ@ZnPc-ALN possessed favorable bone affinity both in vitro and in vivo and could release drug in a pH-responsive manner. Under irradiation, BTZ@ZnPc-ALN could generate reactive oxygen species (ROS) to cause mitochondrial damage, and increase the cytosolic Ca(2+) levels and the expression of GRP78 protein to induce excessive endoplasmic reticulum (ER) stress, thereby synergistically inhibiting cell proliferation. More importantly, BTZ@ZnPc-ALN could prolong blood circulation time and preferentially navigate to the bone affected site. As a result, tumor growth was significantly inhibited by bone targeted chemo-photodynamic therapy, with tumor volume cut down by 85% compared with PBS group and bone remained undamaged. Besides, the systemic toxicity of BTZ was significantly reduced. Therefore, the versatile nanoagent is expected to be a promising nanoplatform to concern multiple intracellular stress for remarkable synergistic chemo-photodynamic therapy of bone metastases."
31878046,Attenuation of STAT3 Signaling Cascade by Daidzin Can Enhance the Apoptotic Potential of Bortezomib against Multiple Myeloma.,"Yang MH, Jung SH, Chinnathambi A, Alahmadi TA, Alharbi SA, Sethi G, Ahn KS",Biomolecules. 2019 Dec 23;10(1):23. doi: 10.3390/biom10010023.,2019 Dec 23,10.3390/biom10010023 23,10,1,,https://pubmed.ncbi.nlm.nih.gov/31878046,"Daidzin (DDZ) extracted from Pueraria lobate (Fabaceae) is a widely known phytoestrogen. DDZ can display anti-cancer activities against breast and prostate cancers, but its anti-oncogenic actions in multiple myeloma (MM) cells have not been studied. The signal transducer and activator of transcription 3 (STAT3) can control key processes including proliferation, differentiation, and survival in MM cells. Here, we noted that DDZ abrogated STAT3 activation (both constitutive as well as inducible) at Tyr705 and Ser727 in MM cells. Additionally, DDZ mitigated the phosphorylation of STAT3 upstream Janus-activated kinases (JAK1/2) and c-Src kinases. Pervanadate (tyrosine phosphatase blocker) exposure altered the DDZ-induced inhibition of STAT3 activation, thus affecting the action of this phytoestrogen on apoptosis. Moreover, DDZ impeded proliferation and augmented the apoptotic effects of bortezomib (Bor) in MM cells. Overall, the data indicate that DDZ may act as a potent suppressor of STAT3 signaling cascade, and the co-treatment of DDZ and Bor could be a promising therapeutic strategy, specifically in MM."
31754034,Inhibition of dual-specificity tyrosine phosphorylation-regulated kinase 2 perturbs 26S proteasome-addicted neoplastic progression.,"Banerjee S, Wei T, Wang J, Lee JJ, Gutierrez HL, Chapman O, Wiley SE, Mayfield JE, Tandon V, Juarez EF, Chavez L, Liang R, Sah RL, Costello C, Mesirov JP, de la Vega L, Cooper KL, Dixon JE, Xiao J, Lei X",Proc Natl Acad Sci U S A. 2019 Dec 3;116(49):24881-24891. doi: 10.1073/pnas.1912033116. Epub 2019 Nov 21.,2019 Dec 3,10.1073/pnas.1912033116,116,49,24881-24891,https://pubmed.ncbi.nlm.nih.gov/31754034,"Dependence on the 26S proteasome is an Achilles' heel for triple-negative breast cancer (TNBC) and multiple myeloma (MM). The therapeutic proteasome inhibitor, bortezomib, successfully targets MM but often leads to drug-resistant disease relapse and fails in breast cancer. Here we show that a 26S proteasome-regulating kinase, DYRK2, is a therapeutic target for both MM and TNBC. Genome editing or small-molecule mediated inhibition of DYRK2 significantly reduces 26S proteasome activity, bypasses bortezomib resistance, and dramatically delays in vivo tumor growth in MM and TNBC thereby promoting survival. We further characterized the ability of LDN192960, a potent and selective DYRK2-inhibitor, to alleviate tumor burden in vivo. The drug docks into the active site of DYRK2 and partially inhibits all 3 core peptidase activities of the proteasome. Our results suggest that targeting 26S proteasome regulators will pave the way for therapeutic strategies in MM and TNBC."
31708456,Sphingosine-1-phosphate signaling: A novel target for simultaneous adjuvant treatment of triple negative breast cancer and chemotherapy-induced neuropathic pain.,"Singh SK, Spiegel S",Adv Biol Regul. 2020 Jan;75:100670. doi: 10.1016/j.jbior.2019.100670. Epub 2019 Oct 15.,2020 Jan,S2212-4926(19)30091-0 [pii] 10.1016/j.jbior.2019.100670,75,,100670,https://pubmed.ncbi.nlm.nih.gov/31708456,"Triple-negative breast cancer (TNBC) is very aggressive with high metastatic and mortality rates and unfortunately, except for chemotherapy, there are few therapeutic options. The bioactive sphingolipid metabolite sphingosine-1-phosphate (S1P) regulates numerous processes important for cancer progression, metastasis, and neuropathic pain. The pro-drug FTY720 (fingolimod, Gilenya) used to treat multiple sclerosis is phosphorylated in the body to a S1P mimic that binds to S1PRs, except S1PR2, and also acts as a functional antagonist of S1PR1. This review highlights current findings showing that FTY720 has multiple anti-cancer activities and simultaneously prevents formation and actions of S1P. Moreover, in mouse breast cancer models, treatment with FTY720 reduces tumor growth, metastasis, and enhances sensitivity of advanced and hormonal refractory breast cancer and TNBC to conventional therapies. We discuss recent studies demonstrating that neuropathic pain induced by the chemotherapeutic bortezomib is also greatly reduced by administration of clinically relevant doses of FTY720, likely by targeting S1PR1 on astrocytes. FTY720 also shows promising anticancer potential in pre-clinical studies and is FDA approved, thus we suggest in this review that further studies are needed to pave the way for fast-tracking approval of FTY720/fingolimod for enhancing chemotherapy effectiveness and reduction of painful neuropathies."
31569723,Proteasome Inhibitors Suppress ErbB Family Expression through HSP90-Mediated Lysosomal Degradation.,"Huynh TK, Ho CY, Tsai CH, Wang CK, Chen YJ, Bau DT, Tu CY, Li TS, Huang WC",Int J Mol Sci. 2019 Sep 27;20(19):4812. doi: 10.3390/ijms20194812.,2019 Sep 27,10.3390/ijms20194812 4812,20,19,,https://pubmed.ncbi.nlm.nih.gov/31569723,"Although dual EGFR/HER2 tyrosine kinase inhibitor lapatinib has provided effective clinical benefits for HER2-positive breast cancer patients, acquired resistance to this drug remains a major concern. Thus, the development of alternative therapeutic strategies is urgently needed for patients who failed lapatinib treatment. Proteasome inhibitors have been reported to possess high anti-tumor activity to breast cancer cells. Therefore, this study aims to examine whether and how proteasome inhibitor bortezomib can overcome lapatinib resistance. Treatments with several proteasome inhibitors, including Bortezomib, MG132, and proteasome inhibitor I (PSI), as well as the viabilities of both HER2-positive breast cancer cell lines and their lapatinib-resistant clones, were inhibited. Importantly, the expressions of ErbB family were downregulated at both transcriptional and translational levels. Also, our results further indicated that proteasome inhibitors decreased ErbB family expression through lysosomal degradation pathway in a heat shock protein 90 (HSP90)-dependent manner. In this study, our data supported a potential approach to overcome the acquired resistance of HER2-overexpressing breast cancer patients to lapatinib using proteasome inhibitors."
31520196,Glycine-Poly-L-Lactic Acid Copolymeric Nanoparticles for the Efficient Delivery of Bortezomib.,"Rajoria S, Rani S, Chaudhari D, Jain S, Gupta U",Pharm Res. 2019 Sep 13;36(11):160. doi: 10.1007/s11095-019-2686-4.,2019 Sep 13,10.1007/s11095-019-2686-4,36,11,160,https://pubmed.ncbi.nlm.nih.gov/31520196,"PURPOSE: Bortezomib (BTZ) is a proteasome inhibitor used for multiple myeloma and mantle cell lymphoma treatment. BTZ's aqueous in solubility is the main hindrance in its successful development as a commercial formulation. The main objective of the present study is to develop and characterize folic acid-glycine-poly-L-lactic acid (FA-Gly(4)-PLA) based nanoformulation (NPs) to improve solubility and efficacy of BTZ. METHODS: BTZ loaded FA-Gly(4)-PLA NPs were prepared and characterized for size, zeta potential, in vitro studies such as release, kinetics modeling, hemolytic toxicity, and cell line-based studies (Reactive Oxygen Species: ROS and cytotoxicity). RESULTS: BTZ loaded NPs (BTZ-loaded FA-Gly(4)-PLA) and blank NPs (FA-Gly(4)-PLA) size, zeta, and PDI were found to be 110 +/- 8.1 nm, 13.7 +/- 1.01 mV, 0.19 +/- 0.03 and 198 +/- 9.01 nm, 8.63 +/- 0.21 mV, 0.21 +/- 0.08 respectively. The percent encapsulation efficiency (% EE) and percent drug loading (% DL) of BTZ loaded FA-Gly(4)-PLA NPs was calculated to be 78.3 +/- 4.1 and 12.38 +/- 2.1. The Scanning Electron Microscopy (SEM) showed that NPs were slightly biconcave in shape. The in vitro release of BTZ from FA-Gly(4)-PLA NPs resulted in the sustained manner. The prepared NPs were less hemolytic than BTZ. CONCLUSIONS: BTZ loaded Gly(4)-PLA NPs apoptotic index was found to be much higher than BTZ but lesser than BTZ loaded FA-Gly(4)-PLA against breast cancer cell lines (MDA-MB-231). ROS intracellular assessment assay indicated that BTZ and BTZ loaded FA-Gly(4)-PLA NPs exhibited higher ROS production. Conclusively, the BTZ loaded FA-Gly(4)-PLA NPs were able to encapsulate more BTZ than BTZ loaded Gly(4)-PLA NPs and were found to be more effective as per as in vitro anti-cancer effect is concerned."
31465531,The lenalidomide/bortezomib/dexamethasone regimen for the treatment of blastic plasmacytoid dendritic cell neoplasm.,"Marmouset V, Joris M, Merlusca L, Beaumont M, Charbonnier A, Marolleau JP, Gruson B",Hematol Oncol. 2019 Oct;37(4):487-489. doi: 10.1002/hon.2671. Epub 2019 Sep 4.,2019 Oct,10.1002/hon.2671,37,4,487-489,https://pubmed.ncbi.nlm.nih.gov/31465531,"We describe the use and value of a lenalidomide/bortezomib/dexamethasone regimen for the treatment of three patients with blastic plasmacytoid dendritic cell neoplasm (BPDCN, a disease that lacks a consensus treatment). After five cycles of chemotherapy, we observed two complete responses and one clinical remission. Together with the encouraging literature data on the effects of lenalidomide and bortezomib on BPDCN cells, our results might prompt further investigations of this regimen's value in BPDCN."
31456939,"Carnosol, a Natural Polyphenol, Inhibits Migration, Metastasis, and Tumor Growth of Breast Cancer via a ROS-Dependent Proteasome Degradation of STAT3.","Alsamri H, El Hasasna H, Al Dhaheri Y, Eid AH, Attoub S, Iratni R",Front Oncol. 2019 Aug 8;9:743. doi: 10.3389/fonc.2019.00743. eCollection 2019.,2019,10.3389/fonc.2019.00743 743,9,,743,https://pubmed.ncbi.nlm.nih.gov/31456939,"We have previously demonstrated that carnosol, a naturally occurring diterpene, inhibited in vitro cell viability and colony growth, as well as induced cell cycle arrest, autophagy and apoptosis in human triple negative breast cancer (TNBC) cells. In the present study, we evaluated the ability of carnosol to inhibit tumor growth and metastasis in vivo. We found that non-cytotoxic concentrations of carnosol inhibited the migration and invasion of MDA-MB-231 cells in wound healing and matrigel invasion assays. Furthermore, gelatin zymography, ELISA, and RT-PCR assays revealed that carnosol inhibited the activity and downregulation the expression of MMP-9. Mechanistically, we demonstrated that carnosol suppressed the activation of STAT3 signaling pathway through a ROS-dependent targeting of STAT3 to proteasome-degradation in breast cancer cells (MDA-MB-231, Hs578T, MCF-7, and T47D). We show that blockade of proteasome activity, by MG-132 and bortezomib, or ROS accumulation, by N-acetylcysteine (NAC), restored the level of STAT3 protein. In addition, using chick embryo tumor growth assay, we showed that carnosol significantly and markedly suppressed tumor growth and metastasis of breast cancer xenografts. To the best of our knowledge, this is the first report which shows that carnosol specifically targets signal transducer and activator of transcription 3 (STAT3) for proteasome degradation in breast cancer. Our study further provide evidence that carnosol may represent a promising therapeutic candidate that canmodulate breast cancer growth and metastasis."
